text,blanks
"""Where's The ______?""",1
"After several strategy meetings, the executive team could only agree on ""More ______"".",1
"At our upcoming marketing conference you are guaranteed to leave with an understanding of ______.",1
"It's so easy, even a ______ can do it!",1
"On Madison Ave, there are rumors that there will be a new microsite devoted to ______.",1
"Please ""like"" our company page on Facebook for 20% off your next ______.",1
"The planning process began after a consultation with ______.",1
"What's the best way to increase ROI?",1
