text,blanks
"A witch doctor offers you immortality. Unfortunately, you have to cuddle with ______.",1
"Epic Software Group is going to revolutionize the industry with their brand new ______",1
"In the alternate dimension version of This Is Spinal Tap, the main character falls in love with ______.",1
"The best way to help the homeless population of Houston would be to give them ______.",1
"University of Houston should probably start teaching a class on ______",1
"University of Houston's newest professor got their PHD studying ______.",1
"What do most Houston crimes involve?",1
"What makes Houston the best place to raise children?",1
