text,blanks
"Be quiet, be calm... name, rank, and ______, nothing else...",1
"But our trip was different. It was a classic affirmation of everything right and true and decent in the national character. A gross, physical salute to the fantastic possibilities of ______.",1
"Consciousness Expansion&rdquo; went out with LBJ &hellip; and it is worth noting, historically, that ______ came in with Nixon.&rdquo;",1
"Every now and then when your life gets complicated and the weasels start closing in, the only real cure is ______.",1
"In a closed society where everybody's guilty, the only crime is ______.",1
"In a world of thieves, the only final sin is ______.",1
"Journalism is not a profession or a trade. It is a cheap catch-all for fuckoffs and misfits&mdash;a false doorway to ______.",1
"Shortly before my murder, I was still vaguely haunted by our hitchhiker’s remark about ______.",1
"______ is what the whole hep world would be doing on Saturday night if the Nazis had won the war.",1
